{
  "$schema": "./schemas/registry.schema.json",
  "schemaVersion": 1,
  "id": "guta-skills",
  "name": "Guta Skills",
  "description": "Personal, agent-agnostic registry of reusable AI agent skills.",
  "skillRoot": "skills",
  "entrypoint": "SKILL.md",
  "skills": [
    {
      "id": "repomix-cli",
      "name": "repomix-cli",
      "title": "Repomix CLI",
      "description": "Pack a whole codebase (local folder or remote GitHub repo) into one AI-ready file with the repomix CLI, defaulting to XML for LLM consumption. Estimates tokens before ingesting and gates packs over ~200k tokens behind user confirmation.",
      "path": "skills/repomix-cli",
      "manifest": "skills/repomix-cli/skill.json",
      "entrypoint": "skills/repomix-cli/SKILL.md",
      "tags": [
        "repomix",
        "codebase-packing",
        "llm-context",
        "code-analysis",
        "cli"
      ],
      "agents": [
        "claude-code",
        "cursor",
        "codex",
        "pi",
        "antigravity",
        "generic"
      ]
    },
    {
      "id": "remove-ai-signs",
      "name": "remove-ai-signs",
      "title": "Remove AI Signs",
      "description": "Revise drafts to remove common AI-writing signs while preserving meaning, facts, citations, voice, and user intent.",
      "path": "skills/remove-ai-signs",
      "manifest": "skills/remove-ai-signs/skill.json",
      "entrypoint": "skills/remove-ai-signs/SKILL.md",
      "tags": [
        "writing",
        "editing",
        "ai-writing",
        "revision",
        "style"
      ],
      "agents": [
        "claude-code",
        "cursor",
        "codex",
        "pi",
        "antigravity",
        "generic"
      ]
    },
    {
      "id": "playwright-cli",
      "name": "playwright-cli",
      "title": "Playwright CLI",
      "description": "Drive a real browser from the shell to navigate, click, fill, snapshot, screenshot, mock network, or run/debug Playwright tests.",
      "path": "skills/playwright-cli",
      "manifest": "skills/playwright-cli/skill.json",
      "entrypoint": "skills/playwright-cli/SKILL.md",
      "tags": [
        "playwright",
        "browser-automation",
        "e2e",
        "testing",
        "scraping"
      ],
      "agents": [
        "claude-code",
        "cursor",
        "codex",
        "pi",
        "antigravity",
        "generic"
      ]
    },
    {
      "id": "deslop",
      "name": "deslop",
      "title": "Deslop",
      "description": "Remove AI-generated code slop from current branch changes while preserving behavior. Use when cleaning diffs, reviewing AI-authored edits, removing unnecessary comments, simplifying defensive code, or aligning changes with local style.",
      "path": "skills/deslop",
      "manifest": "skills/deslop/skill.json",
      "entrypoint": "skills/deslop/SKILL.md",
      "tags": [
        "code-quality",
        "cleanup",
        "review",
        "ai-code",
        "diff"
      ],
      "agents": [
        "claude-code",
        "cursor",
        "codex",
        "pi",
        "antigravity",
        "generic"
      ]
    },
    {
      "id": "thermo-nuclear-code-quality-review",
      "name": "thermo-nuclear-code-quality-review",
      "title": "Thermo-Nuclear Code Quality Review",
      "description": "Perform an unusually strict code quality audit focused on maintainability, abstraction quality, structural simplification, spaghetti reduction, and codebase health. Use when reviewing branch changes for deep implementation quality, not just correctness.",
      "path": "skills/thermo-nuclear-code-quality-review",
      "manifest": "skills/thermo-nuclear-code-quality-review/skill.json",
      "entrypoint": "skills/thermo-nuclear-code-quality-review/SKILL.md",
      "tags": [
        "code-review",
        "code-quality",
        "maintainability",
        "architecture",
        "refactoring"
      ],
      "agents": [
        "claude-code",
        "cursor",
        "codex",
        "pi",
        "antigravity",
        "generic"
      ]
    },
    {
      "id": "skill-reviewer",
      "name": "skill-reviewer",
      "title": "Skill Reviewer",
      "description": "Review agent skills for trigger quality, portability, metadata correctness, installability, and maintainability. Use after creating or editing SKILL.md files, skill manifests, or marketplace-ready skill packages.",
      "path": "skills/skill-reviewer",
      "manifest": "skills/skill-reviewer/skill.json",
      "entrypoint": "skills/skill-reviewer/SKILL.md",
      "tags": [
        "skills",
        "review",
        "metadata",
        "portability",
        "marketplace"
      ],
      "agents": [
        "claude-code",
        "cursor",
        "codex",
        "pi",
        "antigravity",
        "generic"
      ]
    }
  ]
}
